{
  "attachment_id": "00000000-0000-4000-8000-000000000001",
  "workspace_id": "00000000-0000-4000-8000-000000000001",
  "client_upload_id": "00000000-0000-4000-8000-000000000001",
  "blob_version": "synthetic-v1",
  "sha256": "0000000000000000000000000000000000000000000000000000000000000000",
  "media_type": "text/plain",
  "size_bytes": 12,
  "scan_state": "quarantined",
  "created_at": "2026-10-03T00:00:00Z"
}
